<?xml version="1.0" encoding="UTF-8"?>
<cronentries
	xmlns:xsi="http://www.w3.org/2001/XMLSchema-instance"
	xsi:noNamespaceSchemaLocation="cron.xsd">
  <cron>
    <url>/recache</url>
    <description>Repopulate the cache every 2 minutes</description>
    <schedule>every 2 minutes</schedule>
  </cron>
  <cron>
    <url>/weeklyreport</url>
    <description>Mail out a weekly report</description>
    <schedule>every monday 08:30</schedule>
    <timezone>America/New_York</timezone>
  </cron>
</cronentries>